{
  "contract_version": "1.0.0",
  "event_id": "evt_ff22754686ae4bc9",
  "raw_event_id": "raw_ab945b6de2b64b76",
  "source_id": "src_394fd63e4b4549c3",
  "evidence": {
    "raw_event_id": "raw_ab945b6de2b64b76",
    "payload": {
      "uri": "file://intake/raw/raw_ab945b6de2b64b76.dat",
      "sha256": "83d101299d67f6cbf0574fb917e96154a25979a7d41ca2d999ea8ada3930d97b",
      "byte_length": 144,
      "media_type": "text/plain",
      "encoding": "utf-8",
      "retention_class": "standard"
    },
    "payload_sha256": "83d101299d67f6cbf0574fb917e96154a25979a7d41ca2d999ea8ada3930d97b",
    "evidence_manifest_id": "evm_4e04305ec5f645a9"
  },
  "event": {
    "time": "2026-09-16T18:34:45.451760+00:00",
    "category": "security",
    "type": "firewall",
    "class": "perimeter_firewall_event",
    "action": "deny",
    "severity": 0,
    "source": {
      "ip": "198.51.100.99",
      "port": 51234
    },
    "destination": {
      "ip": "10.0.0.1",
      "port": 443
    },
    "network": {
      "protocol": "TCP",
      "direction": "inbound"
    },
    "device": {},
    "identity": {},
    "metadata": {
      "parser_id": "parser.opnsense.filterlog",
      "format": "opnsense_filterlog",
      "ingest_timestamp": "2026-09-16T14:00:00+00:00",
      "vendor": "Deciso",
      "product": "OPNsense Firewall"
    }
  },
  "unmapped_fields": {
    "rule_number": "100",
    "tracker": "010000",
    "interface": "em0",
    "reason": "match",
    "ip_version": "4",
    "tos": "0x0",
    "ttl": "64",
    "id": "0",
    "offset": "0",
    "ip_flags": "DF",
    "protocol_id": "6",
    "length": "60",
    "tcp_flags": "123456789"
  },
  "field_provenance": {
    "event.time": {
      "origin": "inferred",
      "transformation_id": "ulpf.normalization.canonical:1.0.0",
      "rule_version": "1.0.0",
      "confidence": 1.0
    },
    "event.category": {
      "origin": "inferred",
      "transformation_id": "ulpf.normalization.canonical:1.0.0",
      "rule_version": "1.0.0",
      "confidence": 1.0
    },
    "event.type": {
      "origin": "inferred",
      "transformation_id": "ulpf.normalization.canonical:1.0.0",
      "rule_version": "1.0.0",
      "confidence": 1.0
    },
    "event.action": {
      "origin": "derived",
      "transformation_id": "ulpf.normalization.canonical:1.0.0",
      "rule_version": "1.0.0",
      "confidence": 1.0,
      "raw_paths": [
        "opnsense_filterlog:action"
      ],
      "input_field_paths": [
        "action"
      ]
    },
    "event.source.ip": {
      "origin": "observed",
      "transformation_id": "ulpf.normalization.canonical:1.0.0",
      "rule_version": "1.0.0",
      "confidence": 1.0,
      "raw_paths": [
        "opnsense_filterlog:src_ip"
      ],
      "input_field_paths": [
        "src_ip"
      ]
    },
    "event.source.port": {
      "origin": "observed",
      "transformation_id": "ulpf.normalization.canonical:1.0.0",
      "rule_version": "1.0.0",
      "confidence": 1.0,
      "raw_paths": [
        "opnsense_filterlog:src_port"
      ],
      "input_field_paths": [
        "src_port"
      ]
    },
    "event.destination.ip": {
      "origin": "observed",
      "transformation_id": "ulpf.normalization.canonical:1.0.0",
      "rule_version": "1.0.0",
      "confidence": 1.0,
      "raw_paths": [
        "opnsense_filterlog:dst_ip"
      ],
      "input_field_paths": [
        "dst_ip"
      ]
    },
    "event.destination.port": {
      "origin": "observed",
      "transformation_id": "ulpf.normalization.canonical:1.0.0",
      "rule_version": "1.0.0",
      "confidence": 1.0,
      "raw_paths": [
        "opnsense_filterlog:dst_port"
      ],
      "input_field_paths": [
        "dst_port"
      ]
    },
    "event.network.protocol": {
      "origin": "observed",
      "transformation_id": "ulpf.normalization.canonical:1.0.0",
      "rule_version": "1.0.0",
      "confidence": 1.0,
      "raw_paths": [
        "opnsense_filterlog:protocol"
      ],
      "input_field_paths": [
        "protocol"
      ]
    },
    "event.network.direction": {
      "origin": "derived",
      "transformation_id": "ulpf.normalization.canonical:1.0.0",
      "rule_version": "1.0.0",
      "confidence": 1.0,
      "raw_paths": [
        "opnsense_filterlog:direction"
      ],
      "input_field_paths": [
        "direction"
      ]
    }
  },
  "processing": {
    "processing_run_id": "run_ba4c59ee2c194a96",
    "source_profile": {
      "id": "srcprof.deciso.opnsense firewall",
      "version": "1.0.0"
    },
    "parser": {
      "id": "parser.opnsense.filterlog",
      "version": "1.0.0"
    },
    "mapping": {
      "id": "map.opnsense_filterlog.uce_v1",
      "version": "1.0.0"
    },
    "schema": {
      "id": "https://ulpf.local/contracts/jsonschema/normalized-event.v1.schema.json",
      "version": "1.0.0"
    },
    "processed_at": "2026-09-16T14:00:00+00:00"
  },
  "lineage": {
    "uri": "ulpf://lineage/run_ba4c59ee2c194a96/evt_ff22754686ae4bc9",
    "sha256": "83d101299d67f6cbf0574fb917e96154a25979a7d41ca2d999ea8ada3930d97b",
    "byte_length": 144,
    "media_type": "application/json"
  },
  "output_projections": [
    "ulpf",
    "json",
    "ndjson"
  ]
}